target_word_unique,word_combo_related,word_combo_unrelated,cue_word_related,cue_word_unrelated
วิญญาณ,จิตวิญญาณวิญญาณ,บทความวิญญาณ,จิตวิญญาณ,บทความ
วิดีโอ,ดีวีดีวิดีโอ,พระราชวังวิดีโอ,ดีวีดี,พระราชวัง
วิตามิน,โปรตีนวิตามิน,โคลนวิตามิน,โปรตีน,โคลน
วิทยาศาสตร์,เทคโนโลยีวิทยาศาสตร์,มุมมองวิทยาศาสตร์,เทคโนโลยี,มุมมอง
วินาศกรรม,จารกรรมวินาศกรรม,การงีบหลับวินาศกรรม,จารกรรม,การงีบหลับ
วิสัยทัศน์,การเปิดเผยวิสัยทัศน์,คำวิสัยทัศน์,การเปิดเผย,คำ
วุฒิสภา,รัฐสภาวุฒิสภา,ผู้แพ้วุฒิสภา,รัฐสภา,ผู้แพ้
วุฒิสมาชิก,ผู้ว่าราชการวุฒิสมาชิก,อุปสรรควุฒิสมาชิก,ผู้ว่าราชการ,อุปสรรค
ว่ายน้ำ,จมน้ำว่ายน้ำ,ผู้สื่อข่าวว่ายน้ำ,จมน้ำ,ผู้สื่อข่าว
ศพ,ร่างกายศพ,ความคิดเห็นศพ,ร่างกาย,ความคิดเห็น
ศักดิ์ศรี,ความภาคภูมิใจศักดิ์ศรี,เขียวศักดิ์ศรี,ความภาคภูมิใจ,เขียว
ศักดิ์สิทธิ์,พระเจ้าศักดิ์สิทธิ์,ฤดูร้อนศักดิ์สิทธิ์,พระเจ้า,ฤดูร้อน
ศาสตราจารย์,คณบดีศาสตราจารย์,ความเคารพศาสตราจารย์,คณบดี,ความเคารพ
ศาสนา,ปรัชญาศาสนา,ปางตายศาสนา,ปรัชญา,ปางตาย
ศึกษา,วิจัยศึกษา,เงาศึกษา,วิจัย,เงา
สกปรกโสมม,น่าสะอิดสะเอียนสกปรกโสมม,สถานะสกปรกโสมม,น่าสะอิดสะเอียน,สถานะ
สงบ,เงียบสงบ,ความถี่สงบ,เงียบ,ความถี่
สงบเสงี่ยม,ถ่อมตนสงบเสงี่ยม,รถแท็กซี่สงบเสงี่ยม,ถ่อมตน,รถแท็กซี่
สง่างาม,ทันสมัยสง่างาม,เปรี้ยงสง่างาม,ทันสมัย,เปรี้ยง
สตรอเบอร์รี่,กล้วยสตรอเบอร์รี่,รถพยาบาลสตรอเบอร์รี่,กล้วย,รถพยาบาล
สถานี,ชานชาลาสถานี,ความสำเร็จสถานี,ชานชาลา,ความสำเร็จ
สถาปนิก,วิศวกรสถาปนิก,ละเอียดอ่อนสถาปนิก,วิศวกร,ละเอียดอ่อน
สนามบิน,อาคารผู้โดยสารสนามบิน,ยอดเยี่ยมสนามบิน,อาคารผู้โดยสาร,ยอดเยี่ยม
สนามรบ,สังเวียนสนามรบ,เก่าแก่สนามรบ,สังเวียน,เก่าแก่
สปาเก็ตตี้,ลาซานย่าสปาเก็ตตี้,การมีอยู่สปาเก็ตตี้,ลาซานย่า,การมีอยู่
สภาพสตรี,ท่านลอร์ดสภาพสตรี,มีประโยชน์สภาพสตรี,ท่านลอร์ด,มีประโยชน์
สมบูรณ์,ทั้งหมดสมบูรณ์,จิตวิญญาณสมบูรณ์,ทั้งหมด,จิตวิญญาณ
สมบูรณ์แบบ,ในอุดมคติสมบูรณ์แบบ,พันสมบูรณ์แบบ,ในอุดมคติ,พัน
สร้อยคอ,แหวนสร้อยคอ,เขตสร้อยคอ,แหวน,เขต
สร้าง,การก่อสร้างสร้าง,ไปรษณีย์สร้าง,การก่อสร้าง,ไปรษณีย์
สลัด,ซุปสลัด,สมาคมสลัด,ซุป,สมาคม
สว่าง,ส่องแสงสว่าง,โซฟาสว่าง,ส่องแสง,โซฟา
สหพันธรัฐ,อาณานิคมสหพันธรัฐ,ฝนสหพันธรัฐ,อาณานิคม,ฝน
สอน,เรียนรู้สอน,สังเวียนสอน,เรียนรู้,สังเวียน
สอบสวน,พิจารณาสอบสวน,กายวิภาคศาสตร์สอบสวน,พิจารณา,กายวิภาคศาสตร์
สัญญา,รับประกันสัญญา,ท่าทางสัญญา,รับประกัน,ท่าทาง
สัญญาณ,ความถี่สัญญาณ,การฆ่าตัวตายสัญญาณ,ความถี่,การฆ่าตัวตาย
สัญญาณเตือนภัย,การแจ้งเตือนสัญญาณเตือนภัย,ความไม่รู้สัญญาณเตือนภัย,การแจ้งเตือน,ความไม่รู้
สัญลักษณ์,ธงสัญลักษณ์,กลางคืนสัญลักษณ์,ธง,กลางคืน
สัตว์,สัตว์ร้ายสัตว์,แสดงความยินดีสัตว์,สัตว์ร้าย,แสดงความยินดี
สัปดาห์,เดือนสัปดาห์,ไร้เดียงสาสัปดาห์,เดือน,ไร้เดียงสา
สั่ง,สั่งการสั่ง,เกี่ยวกับแม่เหล็กสั่ง,สั่งการ,เกี่ยวกับแม่เหล็ก
สาม,หนึ่งสาม,ผู้จัดการสาม,หนึ่ง,ผู้จัดการ
สามเท่า,สองเท่าสามเท่า,อิทธิพลสามเท่า,สองเท่า,อิทธิพล
สามเหลี่ยม,วงกลมสามเหลี่ยม,คนสามเหลี่ยม,วงกลม,คน
สายยาง,เครื่องสูบน้ำสายยาง,งบประมาณสายยาง,เครื่องสูบน้ำ,งบประมาณ
สายไฟ,สายเคเบิลสายไฟ,โคเคนสายไฟ,สายเคเบิล,โคเคน
สารภาพ,ยอมรับสารภาพ,ต่ำสารภาพ,ยอมรับ,ต่ำ
สารสนเทศ,ข้อมูลสารสนเทศ,การไอสารสนเทศ,ข้อมูล,การไอ
สาเหตุ,เหตุผลสาเหตุ,สถานเลี้ยงเด็กกำพร้าสาเหตุ,เหตุผล,สถานเลี้ยงเด็กกำพร้า
สำคัญ,มีค่าสำคัญ,ทรมานสำคัญ,มีค่า,ทรมาน
สำนักงาน,โต๊ะทำงานสำนักงาน,อ่านสำนักงาน,โต๊ะทำงาน,อ่าน
สำนักแม่ชี,สถานเลี้ยงเด็กกำพร้าสำนักแม่ชี,โกหกสำนักแม่ชี,สถานเลี้ยงเด็กกำพร้า,โกหก
สำเนา,ต้นฉบับสำเนา,ระดับชาติสำเนา,ต้นฉบับ,ระดับชาติ
สำเนียง,เสียงสำเนียง,ทหารม้าสำเนียง,เสียง,ทหารม้า
สิงโต,มังกรสิงโต,เรียกร้องสิงโต,มังกร,เรียกร้อง
สินค้า,ของบรรทุกสินค้า,คำสาปสินค้า,ของบรรทุก,คำสาป
สิ่งก่อสร้าง,พีระมิดสิ่งก่อสร้าง,แก้วสิ่งก่อสร้าง,พีระมิด,แก้ว
สิ่งนั้น,อะไรสิ่งนั้น,ดีวีดีสิ่งนั้น,อะไร,ดีวีดี
สิ่งปฏิกูล,ขยะสิ่งปฏิกูล,การลงจอดสิ่งปฏิกูล,ขยะ,การลงจอด
สิ่งมีชีวิต,สัตว์ประหลาดสิ่งมีชีวิต,การตระเวนแสดงผลงานสิ่งมีชีวิต,สัตว์ประหลาด,การตระเวนแสดงผลงาน
สีดำ,สีขาวสีดำ,จารกรรมสีดำ,สีขาว,จารกรรม
สีฟ้า,สีน้ำตาลสีฟ้า,ความหวังสีฟ้า,สีน้ำตาล,ความหวัง
สีเหลือง,สีแดงสีเหลือง,ให้อาหารสีเหลือง,สีแดง,ให้อาหาร
สี่,สองสี่,แชมเปียนสี่,สอง,แชมเปียน
สืบทอด,มรดกสืบทอด,จำเป็นสืบทอด,มรดก,จำเป็น
สุสาน,หลุมฝังศพสุสาน,ประยุกต์ใช้สุสาน,หลุมฝังศพ,ประยุกต์ใช้
สูง,ต่ำสูง,ปฏิเสธสูง,ต่ำ,ปฏิเสธ
ส่ง,นำมาส่ง,เที่ยงคืนส่ง,นำมา,เที่ยงคืน
ส่วนผสม,การผสมผสานส่วนผสม,พฤศจิกายนส่วนผสม,การผสมผสาน,พฤศจิกายน
ส้ม,เขียวส้ม,ป้องกันส้ม,เขียว,ป้องกัน
ส้อม,ช้อนส้อม,ฤดูใบไม้ผลิส้อม,ช้อน,ฤดูใบไม้ผลิ
หญิง,ชายหญิง,ทุบหญิง,ชาย,ทุบ
หนวดเครา,ผมหนวดเครา,การทดสอบหนวดเครา,ผม,การทดสอบ
หนังสือ,คัมภีร์ไบเบิลหนังสือ,กระรอกหนังสือ,คัมภีร์ไบเบิล,กระรอก
หนังสือพิมพ์,บทความหนังสือพิมพ์,ความภักดีหนังสือพิมพ์,บทความ,ความภักดี
หนังสือเดินทาง,ตั๋วหนังสือเดินทาง,แนวคิดหนังสือเดินทาง,ตั๋ว,แนวคิด
หนา,บางหนา,บทละครหนา,บาง,บทละคร
หนึ่งในสี่,ครึ่งหนึ่งในสี่,สงสัยหนึ่งในสี่,ครึ่ง,สงสัย
หนู,มุสิกหนู,ส่วนตัวหนู,มุสิก,ส่วนตัว
หน้าที่,ความรับผิดชอบหน้าที่,มือปืนหน้าที่,ความรับผิดชอบ,มือปืน
หน้าอก,ท้องหน้าอก,จัดการหน้าอก,ท้อง,จัดการ
หมวก,แว่นตาหมวก,ทางการแพทย์หมวก,แว่นตา,ทางการแพทย์
หมวก.1,หมวกนิรภัยหมวก,รายงานหมวก,หมวกนิรภัย,รายงาน
หมอก,ก้อนเมฆหมอก,บุคคลหมอก,ก้อนเมฆ,บุคคล
หมาป่า,หมีหมาป่า,สายหมาป่า,หมี,สาย
หมุน,เปลี่ยนหมุน,พยุหเสนาหมุน,เปลี่ยน,พยุหเสนา
หมู,วัวหมู,สมรรถภาพหมู,วัว,สมรรถภาพ
หมู่บ้าน,ค่ายหมู่บ้าน,อาการหมู่บ้าน,ค่าย,อาการ
หยุด,ป้องกันหยุด,ห้องขังหยุด,ป้องกัน,ห้องขัง
หลบหนี,หนีหลบหนี,สุภาพหลบหนี,หนี,สุภาพ
หลอดเลือดแดง,หลอดเลือดดำหลอดเลือดแดง,วัยหนุ่มสาวหลอดเลือดแดง,หลอดเลือดดำ,วัยหนุ่มสาว
หลัก,รองหลัก,งานหลัก,รอง,งาน
หลานชาย,หลานปู่หลานชาย,พลเรือนหลานชาย,หลานปู่,พลเรือน
หลิง,หมิงหลิง,เครื่องดื่มหลิง,หมิง,เครื่องดื่ม
หอมหัวใหญ่,กระเทียมหอมหัวใหญ่,อำนาจศาลหอมหัวใหญ่,กระเทียม,อำนาจศาล
หัวเราะ,ยิ้มหัวเราะ,เกี่ยวกับจักรพรรดิหัวเราะ,ยิ้ม,เกี่ยวกับจักรพรรดิ
หา,ค้นหาหา,สงครามหา,ค้นหา,สงคราม
หิมะ,ฝนหิมะ,ผู้ลักพาตัวหิมะ,ฝน,ผู้ลักพาตัว
หิว,เหนื่อยหิว,ซอฟต์แวร์หิว,เหนื่อย,ซอฟต์แวร์
หุบเขา,ทะเลทรายหุบเขา,เกี่ยวกับปรมาณูหุบเขา,ทะเลทราย,เกี่ยวกับปรมาณู
หู,ดวงตาหู,น่าหัวเราะหู,ดวงตา,น่าหัวเราะ
หูหนวก,ตาบอดหูหนวก,เสรีภาพหูหนวก,ตาบอด,เสรีภาพ
ห้องนอน,ห้องห้องนอน,กบห้องนอน,ห้อง,กบ
ห้องสวดมนต์,โบสถ์ห้องสวดมนต์,สัตว์ประหลาดห้องสวดมนต์,โบสถ์,สัตว์ประหลาด
ห้องอาบน้ำ,ห้องอาบน้ำฝักบัวห้องอาบน้ำ,อนุสาวรีย์ห้องอาบน้ำ,ห้องอาบน้ำฝักบัว,อนุสาวรีย์
ห้ามปราม,ต้องห้ามห้ามปราม,เพ่งความสนใจห้ามปราม,ต้องห้าม,เพ่งความสนใจ
องคชาติ,ช่องคลอดองคชาติ,แทนที่องคชาติ,ช่องคลอด,แทนที่
องค์ประกอบ,ปัจจัยองค์ประกอบ,เศรษฐีองค์ประกอบ,ปัจจัย,เศรษฐี
อดีต,อนาคตอดีต,เหมาะสมอดีต,อนาคต,เหมาะสม
อนุภาค,สสารอนุภาค,อัจฉริยภาพอนุภาค,สสาร,อัจฉริยภาพ
อย่างชัดแจ้ง,อย่างชัดเจนอย่างชัดแจ้ง,จ่าอย่างชัดแจ้ง,อย่างชัดเจน,จ่า
อย่างมาก,อย่างที่สุดอย่างมาก,ดันอย่างมาก,อย่างที่สุด,ดัน
อย่างรวดเร็ว,อย่างเชื่องช้าอย่างรวดเร็ว,ลูกกระสุนปืนอย่างรวดเร็ว,อย่างเชื่องช้า,ลูกกระสุนปืน
อย่างสมบูรณ์,อย่างแน่นอนอย่างสมบูรณ์,ดีอย่างสมบูรณ์,อย่างแน่นอน,ดี
อย่างหนัก,หนักอย่างหนัก,ห่านอย่างหนัก,หนัก,ห่าน
อย่างแรงกล้า,อย่างหนักแน่นอย่างแรงกล้า,การชันสูตรพลิกศพอย่างแรงกล้า,อย่างหนักแน่น,การชันสูตรพลิกศพ
อร่อย,โอชาอร่อย,ตรงข้ามอร่อย,โอชา,ตรงข้าม
ออกกำลังกาย,ฝึกฝนออกกำลังกาย,บันทึกออกกำลังกาย,ฝึกฝน,บันทึก
ออกซิเจน,อากาศออกซิเจน,แอฟริกาออกซิเจน,อากาศ,แอฟริกา
อะดรีนาลีน,ฮอร์โมนอะดรีนาลีน,ระบายสีอะดรีนาลีน,ฮอร์โมน,ระบายสี
อะพาร์ตเมนต์,บ้านอะพาร์ตเมนต์,ของเหลวอะพาร์ตเมนต์,บ้าน,ของเหลว
อัญมณี,เพชรอัญมณี,ตรงไปตรงมาอัญมณี,เพชร,ตรงไปตรงมา
อันตราย,ความเสี่ยงอันตราย,ถืออันตราย,ความเสี่ยง,ถือ
อัศจรรย์,น่าประทับใจอัศจรรย์,ความต้านทานอัศจรรย์,น่าประทับใจ,ความต้านทาน
อาการบาดเจ็บ,บาดแผลอาการบาดเจ็บ,ป่าดงดิบอาการบาดเจ็บ,บาดแผล,ป่าดงดิบ
อาคาร,หอคอยอาคาร,อบอุ่นอาคาร,หอคอย,อบอุ่น
อาชญากร,ขโมยอาชญากร,ที่อื่นอาชญากร,ขโมย,ที่อื่น
อาชญากรรม,บาปอาชญากรรม,การเปิดเผยอาชญากรรม,บาป,การเปิดเผย
อาณาจักร,ราชวงศ์อาณาจักร,คณะกรรมการอาณาจักร,ราชวงศ์,คณะกรรมการ
อารยธรรม,วัฒนธรรมอารยธรรม,ความลับอารยธรรม,วัฒนธรรม,ความลับ
อาราม,วัดอาราม,คำตอบอาราม,วัด,คำตอบ
อาวุธ,ปืนพกอาวุธ,บวกอาวุธ,ปืนพก,บวก
อาหารกลางวัน,อาหารว่างอาหารกลางวัน,เรดาร์อาหารกลางวัน,อาหารว่าง,เรดาร์
อาหารเช้า,อาหารเย็นอาหารเช้า,ความชั่วร้ายอาหารเช้า,อาหารเย็น,ความชั่วร้าย
อำนาจ,อำนาจศาลอำนาจ,เนื้องอกอำนาจ,อำนาจศาล,เนื้องอก
อำเภอ,เขตอำเภอ,นักฆ่าอำเภอ,เขต,นักฆ่า
อิสระ,อย่างอิสระอิสระ,กระดาษอิสระ,อย่างอิสระ,กระดาษ
อุณหภูมิ,ความร้อนอุณหภูมิ,สามีอุณหภูมิ,ความร้อน,สามี
อุบัติเหตุ,เหตุการณ์อุบัติเหตุ,เสนออุบัติเหตุ,เหตุการณ์,เสนอ
อุปกรณ์,เครื่องมืออุปกรณ์,ตระหนักอุปกรณ์,เครื่องมือ,ตระหนัก
อุปกรณ์.1,ชิปคอมพิวเตอร์อุปกรณ์,มรดกอุปกรณ์,ชิปคอมพิวเตอร์,มรดก
อุโมงค์,สะพานอุโมงค์,โยคะอุโมงค์,สะพาน,โยคะ
อเมริกา,แอฟริกาอเมริกา,สมอเรืออเมริกา,แอฟริกา,สมอเรือ
อ่อนวัย,เก่าแก่อ่อนวัย,ผิดกฎหมายอ่อนวัย,เก่าแก่,ผิดกฎหมาย
อ่อนแอ,แข็งแกร่งอ่อนแอ,ทำให้กลัวอ่อนแอ,แข็งแกร่ง,ทำให้กลัว
อ่อนโยน,อ่อนนุ่มอ่อนโยน,น้ำมะนาวอ่อนโยน,อ่อนนุ่ม,น้ำมะนาว
อ่อนไหว,ละเอียดอ่อนอ่อนไหว,ประกาศนียบัตรอ่อนไหว,ละเอียดอ่อน,ประกาศนียบัตร
อ่างล้างมือ,ห้องน้ำอ่างล้างมือ,ยูเอฟโออ่างล้างมือ,ห้องน้ำ,ยูเอฟโอ
เกม,การเล่นเกม,ลงมาเกม,การเล่น,ลงมา
เกย์,เลสเบี้ยนเกย์,อาณานิคมเกย์,เลสเบี้ยน,อาณานิคม
เกราะ,โล่เกราะ,ทารุณเกราะ,โล่,ทารุณ
เกิดขึ้น,ปรากฎขึ้นเกิดขึ้น,เรื่องทางเพศเกิดขึ้น,ปรากฎขึ้น,เรื่องทางเพศ
เกียรติยศ,สิทธิพิเศษเกียรติยศ,กิโลเมตรเกียรติยศ,สิทธิพิเศษ,กิโลเมตร
เกี่ยวกับการทำหน้าที่,เกี่ยวกับการดำเนินงานเกี่ยวกับการทำหน้าที่,ชื่อเกี่ยวกับการทำหน้าที่,เกี่ยวกับการดำเนินงาน,ชื่อ
เกี่ยวกับชีววิทยา,เกี่ยวกับเคมีเกี่ยวกับชีววิทยา,วอชิงตันเกี่ยวกับชีววิทยา,เกี่ยวกับเคมี,วอชิงตัน
เกี่ยวกับช่องท้อง,เกี่ยวกับกระดูกสันหลังเกี่ยวกับช่องท้อง,เกี่ยวกับเคมีเกี่ยวกับช่องท้อง,เกี่ยวกับกระดูกสันหลัง,เกี่ยวกับเคมี
เกี่ยวกับนิวเคลียร์,เกี่ยวกับปรมาณูเกี่ยวกับนิวเคลียร์,จงรักภักดีเกี่ยวกับนิวเคลียร์,เกี่ยวกับปรมาณู,จงรักภักดี
เกี่ยวกับฝรั่งเศส,เกี่ยวกับอังกฤษเกี่ยวกับฝรั่งเศส,ขวาเกี่ยวกับฝรั่งเศส,เกี่ยวกับอังกฤษ,ขวา
เกี่ยวกับสมอง,สมองเกี่ยวกับสมอง,งานอดิเรกเกี่ยวกับสมอง,สมอง,งานอดิเรก
