target_word_unique,word_combo_related,word_combo_unrelated,cue_word_related,cue_word_unrelated
กด,ปุ่มกด,ระยะทางกด,ปุ่ม,ระยะทาง
กรกฎาคม,มิถุนายนกรกฎาคม,เคลื่อนไหวกรกฎาคม,มิถุนายน,เคลื่อนไหว
กรรมการ,คณะกรรมการกรรมการ,กอล์ฟกรรมการ,คณะกรรมการ,กอล์ฟ
กรรมาธิการ,ผู้ตรวจการณ์กรรมาธิการ,อาหารกรรมาธิการ,ผู้ตรวจการณ์,อาหาร
กระจก,ภาพสะท้อนกระจก,ความคิดกระจก,ภาพสะท้อน,ความคิด
กระต่าย,สุนัขจิ้งจอกกระต่าย,วิทยุกระต่าย,สุนัขจิ้งจอก,วิทยุ
กระทรวง,สถานทูตกระทรวง,ติดตาม,สถานทูต,ติดตาม
กระสุน,ลำกล้องปืนกระสุน,นับกระสุน,ลำกล้องปืน,นับ
กระเป๋าสตางค์,กระเป๋าเสื้อหรือกางเกงกระเป๋าสตางค์,เวทมนตร์กระเป๋าสตางค์,กระเป๋าเสื้อหรือกางเกง,เวทมนตร์
กระเป๋าเดินทาง,กระเป๋าเอกสารกระเป๋าเดินทาง,วิทยาลัยกระเป๋าเดินทาง,กระเป๋าเอกสาร,วิทยาลัย
กระโดด,ปีนกระโดด,วิสกี้กระโดด,ปีน,วิสกี้
กรัม,กิโลกรัม,เสนอกรัม,กิโล,เสนอ
กริ๊ง,เปรี้ยงกริ๊ง,ที่นี่กริ๊ง,เปรี้ยง,ที่นี่
กรีก,โรมันกรีก,พื้นกรีก,โรมัน,พื้น
กลยุทธ์,แผนการกลยุทธ์,ผับกลยุทธ์,แผนการ,ผับ
กลวิธี,วิธีการกลวิธี,นายกรัฐมนตรีกลวิธี,วิธีการ,นายกรัฐมนตรี
กลางวัน,เที่ยงคืนกลางวัน,สายลับกลางวัน,เที่ยงคืน,สายลับ
กลิ่น,รสชาติกลิ่น,ความอยุติธรรมกลิ่น,รสชาติ,ความอยุติธรรม
กลุ่ม,แก๊งกลุ่ม,ตามธรรมชาติกลุ่ม,แก๊ง,ตามธรรมชาติ
กลุ่มสหพันธ์,มาเฟียกลุ่มสหพันธ์,เปียโนกลุ่มสหพันธ์,มาเฟีย,เปียโน
กลุ้มใจ,กังวลกลุ้มใจ,เสื้อกลุ้มใจ,กังวล,เสื้อ
กล้องจุลทรรศน์,กล้องโทรทรรศน์กล้องจุลทรรศน์,สวยกล้องจุลทรรศน์,กล้องโทรทรรศน์,สวย
กล้ามเนื้อ,เส้นประสาทกล้ามเนื้อ,อาชีพกล้ามเนื้อ,เส้นประสาท,อาชีพ
กล้าหาญ,มีคุณธรรมสูงกล้าหาญ,แบบฟอร์มกล้าหาญ,มีคุณธรรมสูง,แบบฟอร์ม
กว้าง,แคบกว้าง,มีสติกว้าง,แคบ,มีสติ
กองทัพ,พยุหเสนากองทัพ,ขนมปังปิ้งกองทัพ,พยุหเสนา,ขนมปังปิ้ง
กองทัพเรือ,ทหารเรือกองทัพเรือ,จินตนาการกองทัพเรือ,ทหารเรือ,จินตนาการ
กองบัญชาการ,ฐานทัพกองบัญชาการ,รับประกันกองบัญชาการ,ฐานทัพ,รับประกัน
กองพัน,กองทหารกองพัน,อบเชยกองพัน,กองทหาร,อบเชย
กอด,จูบกอด,เหตุการณ์กอด,จูบ,เหตุการณ์
กอริลลา,ลิงกอริลลา,การมาถึงกอริลลา,ลิง,การมาถึง
กะลาสี,โจรสลัดกะลาสี,งานแสดงโชว์กะลาสี,โจรสลัด,งานแสดงโชว์
กะโหลก,กระดูกกะโหลก,รองกะโหลก,กระดูก,รอง
กัปตัน,ผู้บัญชาการกัปตัน,ลำคอกัปตัน,ผู้บัญชาการ,ลำคอ
การกระทำ,ท่าทางการกระทำ,ถนนการกระทำ,ท่าทาง,ถนน
การกลายพันธุ์,วิวัฒนาการการกลายพันธุ์,กังวลการกลายพันธุ์,วิวัฒนาการ,กังวล
การกล่าวหา,การร้องเรียนการกล่าวหา,ปลอดภัยการกล่าวหา,การร้องเรียน,ปลอดภัย
การขาย,การประมูลการขาย,สถานการณ์การขาย,การประมูล,สถานการณ์
การคุมขัง,การลงโทษการคุมขัง,รถถังการคุมขัง,การลงโทษ,รถถัง
การฆาตกรรม,การฆ่าตัวตายการฆาตกรรม,น่าประทับใจการฆาตกรรม,การฆ่าตัวตาย,น่าประทับใจ
การจัดหาเงินทุน,ทางการเงินการจัดหาเงินทุน,ทะเลทรายการจัดหาเงินทุน,ทางการเงิน,ทะเลทราย
การจับปลา,การล่าสัตว์การจับปลา,เงียบการจับปลา,การล่าสัตว์,เงียบ
การฉีดยา,ปริมาณยาการฉีดยา,บางครั้งการฉีดยา,ปริมาณยา,บางครั้ง
การฉ้อโกง,การสมคบคิดการฉ้อโกง,จูบการฉ้อโกง,การสมคบคิด,จูบ
การซ่อมบำรุง,การบริการการซ่อมบำรุง,มุมการซ่อมบำรุง,การบริการ,มุม
การตรวจสอบ,การทดสอบการตรวจสอบ,ยากจนการตรวจสอบ,การทดสอบ,ยากจน
การตลาด,การโฆษณาการตลาด,การติดต่อการตลาด,การโฆษณา,การติดต่อ
การตั้งครรภ์,การเกิดการตั้งครรภ์,เข็มทิศการตั้งครรภ์,การเกิด,เข็มทิศ
การตั้งแคมป์,ปิกนิกการตั้งแคมป์,เสียงข้างมากการตั้งแคมป์,ปิกนิก,เสียงข้างมาก
การติดเชื้อ,ไวรัสการติดเชื้อ,ผู้บัญชาการการติดเชื้อ,ไวรัส,ผู้บัญชาการ
การต่อสู้,การสู้รบการต่อสู้,เครือข่ายการต่อสู้,การสู้รบ,เครือข่าย
การต่อสู้.1,สงครามการต่อสู้,เชอร์ล็อกการต่อสู้,สงคราม,เชอร์ล็อก
การทดสอบ,การทดลองการทดสอบ,พุ่มไม้การทดสอบ,การทดลอง,พุ่มไม้
การทำลาย,การสร้างการทำลาย,กุญแจการทำลาย,การสร้าง,กุญแจ
การบรรยาย,สัมมนาการบรรยาย,อภินิหารการบรรยาย,สัมมนา,อภินิหาร
การบริจาค,การกุศลการบริจาค,รายวันการบริจาค,การกุศล,รายวัน
การบันทึก,บันทึกการบันทึก,ทันสมัยการบันทึก,บันทึก,ทันสมัย
การประชุม,การสัมมนาการประชุม,ซื้อการประชุม,การสัมมนา,ซื้อ
การประหารชีวิต,การแขวนคอการประหารชีวิต,เครื่องกำเนิดไฟฟ้าการประหารชีวิต,การแขวนคอ,เครื่องกำเนิดไฟฟ้า
การประเมิน,การสังเกตการประเมิน,คัดเลือกการประเมิน,การสังเกต,คัดเลือก
การปรับปรุง,ความเปลี่ยนแปลงการปรับปรุง,การแสดงโชว์ของคาวบอยการปรับปรุง,ความเปลี่ยนแปลง,การแสดงโชว์ของคาวบอย
การปล้น,การลักขโมยการปล้น,ประชากรการปล้น,การลักขโมย,ประชากร
การปิด,การเปิดการปิด,สุนัขการปิด,การเปิด,สุนัข
การผลิต,โรงงานการผลิต,พ่อการผลิต,โรงงาน,พ่อ
การผ่าตัด,ผ่าตัดการผ่าตัด,บ้านการผ่าตัด,ผ่าตัด,บ้าน
การพัฒนา,ความก้าวหน้าการพัฒนา,โรงพยาบาลการพัฒนา,ความก้าวหน้า,โรงพยาบาล
การพิจารณาคดี,การไต่สวนการพิจารณาคดี,เปลืองการพิจารณาคดี,การไต่สวน,เปลือง
การพิสูจน์,หลักฐานการพิสูจน์,อย่างที่สุดการพิสูจน์,หลักฐาน,อย่างที่สุด
การระบายอากาศ,วาล์วการระบายอากาศ,อย่างเป็นทางการการระบายอากาศ,วาล์ว,อย่างเป็นทางการ
การระเบิด,แผ่นดินไหวการระเบิด,ปลอมการระเบิด,แผ่นดินไหว,ปลอม
การรักษา,การบำบัดการรักษา,ยิ้มการรักษา,การบำบัด,ยิ้ม
การลงคะแนนเสียง,เสียงข้างมากการลงคะแนนเสียง,โคมไฟการลงคะแนนเสียง,เสียงข้างมาก,โคมไฟ
การลงนาม,ตราประทับการลงนาม,ธรรมดาสามัญการลงนาม,ตราประทับ,ธรรมดาสามัญ
การวางแผน,การเตรียมการการวางแผน,นายอำเภอการวางแผน,การเตรียมการ,นายอำเภอ
การวิเคราะห์,การชันสูตรพลิกศพการวิเคราะห์,เด็กหญิงการวิเคราะห์,การชันสูตรพลิกศพ,เด็กหญิง
การวิ่งแข่ง,การแข่งวิ่งมาราธอนการวิ่งแข่ง,ลงโทษการวิ่งแข่ง,การแข่งวิ่งมาราธอน,ลงโทษ
การศึกษา,สุขภาพการศึกษา,ตัวเลขการศึกษา,สุขภาพ,ตัวเลข
การสาบสูญ,ความตายการสาบสูญ,จบการสาบสูญ,ความตาย,จบ
การสื่อสาร,การนำทางการสื่อสาร,ถ่อมตนการสื่อสาร,การนำทาง,ถ่อมตน
การหยั่งรู้,สัญชาตญาณการหยั่งรู้,ทางการค้าการหยั่งรู้,สัญชาตญาณ,ทางการค้า
การอนุมัติ,การอนุญาตการอนุมัติ,เสียงการอนุมัติ,การอนุญาต,เสียง
การอภิปราย,การสนทนาการอภิปราย,น่าเวทนาการอภิปราย,การสนทนา,น่าเวทนา
การออกเดินทาง,การมาถึงการออกเดินทาง,เนื้อหมูการออกเดินทาง,การมาถึง,เนื้อหมู
การเขียน,การอ่านการเขียน,กำไรการเขียน,การอ่าน,กำไร
การเงิน,การธนาคารการเงิน,ร่างกายการเงิน,การธนาคาร,ร่างกาย
การเชื่อมต่อ,การติดต่อการเชื่อมต่อ,ห้องน้ำการเชื่อมต่อ,การติดต่อ,ห้องน้ำ
การเดินขบวน,การประท้วงการเดินขบวน,ให้อภัยการเดินขบวน,การประท้วง,ให้อภัย
การเดินเล่น,การงีบหลับการเดินเล่น,ช่องการเดินเล่น,การงีบหลับ,ช่อง
การเต้นรำ,นักเต้นการเต้นรำ,ทนายความการเต้นรำ,นักเต้น,ทนายความ
การเทศนา,คำพูดการเทศนา,อิจฉาการเทศนา,คำพูด,อิจฉา
การเมือง,วารสารศาสตร์การเมือง,เล็บการเมือง,วารสารศาสตร์,เล็บ
การเลิกจ้าง,การลาออกการเลิกจ้าง,ปากการเลิกจ้าง,การลาออก,ปาก
การเลือกตั้ง,แคมเปญการเลือกตั้ง,ไข้หวัดใหญ่การเลือกตั้ง,แคมเปญ,ไข้หวัดใหญ่
การแข็งตัว,จุดสุดยอดการแข็งตัว,ทำความสะอาดการแข็งตัว,จุดสุดยอด,ทำความสะอาด
การแข่งขัน,ทัวร์นาเมนต์การแข่งขัน,หมดหนทางการแข่งขัน,ทัวร์นาเมนต์,หมดหนทาง
การแข่งขันชิงแชมป์,การแข่งขันการแข่งขันชิงแชมป์,พี่สาวน้องสาวการแข่งขันชิงแชมป์,การแข่งขัน,พี่สาวน้องสาว
การแต่งงาน,การหย่าร้างการแต่งงาน,หน่วยการแต่งงาน,การหย่าร้าง,หน่วย
การแสดง,งานแสดงโชว์การแสดง,ผู้ที่เหยียดผิวการแสดง,งานแสดงโชว์,ผู้ที่เหยียดผิว
การไม่อยู่,การมีอยู่การไม่อยู่,มังกรการไม่อยู่,การมีอยู่,มังกร
กาแฟ,ถ้วยกาแฟ,ความแข็งแกร่งกาแฟ,ถ้วย,ความแข็งแกร่ง
กาแล็กซี,จักรวาลกาแล็กซี,เชิงบวกกาแล็กซี,จักรวาล,เชิงบวก
กำหนดการ,ปฏิทินกำหนดการ,ทิศใต้กำหนดการ,ปฏิทิน,ทิศใต้
กิจกรรม,คล่องแคล่วกิจกรรม,ทหารกิจกรรม,คล่องแคล่ว,ทหาร
กิน,ให้อาหารกิน,ความมืดกิน,ให้อาหาร,ความมืด
กิ้งก่า,กบกิ้งก่า,วงออเคสตรากิ้งก่า,กบ,วงออเคสตรา
กีตาร์,เปียโนกีตาร์,กล่าวกีตาร์,เปียโน,กล่าว
กีฬา,งานอดิเรกกีฬา,อาสาสมัครกีฬา,งานอดิเรก,อาสาสมัคร
ก้น,ตูดก้น,ผู้เช่าก้น,ตูด,ผู้เช่า
ก้อนหิน,หินก้อนหิน,ห้องโดยสารก้อนหิน,หิน,ห้องโดยสาร
ขวด,แก้วขวด,สัญญาขวด,แก้ว,สัญญา
ของขวัญ,คำชมเชยของขวัญ,ข้างนอกของขวัญ,คำชมเชย,ข้างนอก
ของเล่น,ตุ๊กตาของเล่น,นักอนุรักษ์นิยมของเล่น,ตุ๊กตา,นักอนุรักษ์นิยม
ของไหล,ของเหลวของไหล,ตามลำพังของไหล,ของเหลว,ตามลำพัง
ขอบคุณ,ปลื้มปีติขอบคุณ,พระอาทิตย์ตกดินขอบคุณ,ปลื้มปีติ,พระอาทิตย์ตกดิน
ขอโทษ,ให้อภัยขอโทษ,สุขภาพดีขอโทษ,ให้อภัย,สุขภาพดี
ขั้นตอน,กระบวนการขั้นตอน,ร้อนขั้นตอน,กระบวนการ,ร้อน
ขั้นสูงสุด,ขั้นต่ำสุดขั้นสูงสุด,นายพลขั้นสูงสุด,ขั้นต่ำสุด,นายพล
ขาดความรับผิดชอบ,ไม่มีเหตุผลขาดความรับผิดชอบ,ชานชาลาขาดความรับผิดชอบ,ไม่มีเหตุผล,ชานชาลา
ขาย,ซื้อขาย,ชื่อเล่นขาย,ซื้อ,ชื่อเล่น
ขีปนาวุธ,จรวดขีปนาวุธ,การไร้ความสามารถขีปนาวุธ,จรวด,การไร้ความสามารถ
ขี่,ขับขี่,ชิปคอมพิวเตอร์ขี่,ขับ,ชิปคอมพิวเตอร์
ขึ้นไป,ลงมาขึ้นไป,ผู้ลี้ภัยขึ้นไป,ลงมา,ผู้ลี้ภัย
ข่าว,ช่องข่าว,เล็กน้อยข่าว,ช่อง,เล็กน้อย
ข้อความ,คำเตือนข้อความ,ความยากจนข้อความ,คำเตือน,ความยากจน
ข้อตกลง,สัญญาข้อตกลง,พืชข้อตกลง,สัญญา,พืช
ข้อพิพาท,ความขัดแย้งข้อพิพาท,แมงมุมข้อพิพาท,ความขัดแย้ง,แมงมุม
ข้อสันนิษฐาน,บทสรุปข้อสันนิษฐาน,ตีข้อสันนิษฐาน,บทสรุป,ตี
ข้อแก้ตัว,แรงจูงใจข้อแก้ตัว,ไม่มีเหตุผลข้อแก้ตัว,แรงจูงใจ,ไม่มีเหตุผล
ข้างหลัง,ด้านหน้าข้างหลัง,มือสมัครเล่นข้างหลัง,ด้านหน้า,มือสมัครเล่น
ข้างใน,ข้างนอกข้างใน,สบประมาทข้างใน,ข้างนอก,สบประมาท
คงอยู่,อยู่คงอยู่,ที่ประกอบด้วยทองคงอยู่,อยู่,ที่ประกอบด้วยทอง
คณิตศาสตร์,ฟิสิกส์คณิตศาสตร์,ร้านค้าคณิตศาสตร์,ฟิสิกส์,ร้านค้า
คนขับรถ,ผู้โดยสารคนขับรถ,สีขาวคนขับรถ,ผู้โดยสาร,สีขาว
คนงาน,ชาวนาคนงาน,กำจัดคนงาน,ชาวนา,กำจัด
คนทรยศ,สายลับคนทรยศ,การโฆษณาคนทรยศ,สายลับ,การโฆษณา
คนรัก,อนุภรรยาคนรัก,เชื่อใจคนรัก,อนุภรรยา,เชื่อใจ
คนรับใช้,ทาสคนรับใช้,จัดทำคนรับใช้,ทาส,จัดทำ
คนโกหก,โกหกคนโกหก,ทางออกคนโกหก,โกหก,ทางออก
คนโง่เง่า,คนโง่คนโง่เง่า,เงินปอนด์คนโง่เง่า,คนโง่,เงินปอนด์
ครอบครัว,ตระกูลครอบครัว,อากาศครอบครัว,ตระกูล,อากาศ
คริสเตียน,คาทอลิกคริสเตียน,ความก้าวหน้าคริสเตียน,คาทอลิก,ความก้าวหน้า
ครู,นักเรียนครู,หยดครู,นักเรียน,หยด
คลังสินค้า,ร้านค้าคลังสินค้า,คนโง่คลังสินค้า,ร้านค้า,คนโง่
คลังอาวุธ,สรรพาวุธคลังอาวุธ,คริสต์มาสคลังอาวุธ,สรรพาวุธ,คริสต์มาส
คลาสสิก,ทั่วไปคลาสสิก,กล้องคลาสสิก,ทั่วไป,กล้อง
คลินิก,โรงพยาบาลคลินิก,ตราประทับคลินิก,โรงพยาบาล,ตราประทับ
คลื่นไส้,ท้องเสียคลื่นไส้,อนุภรรยาคลื่นไส้,ท้องเสีย,อนุภรรยา
ความกตัญญู,ความเอื้อเฟื้อเผื่อแผ่ความกตัญญู,บทสรุปความกตัญญู,ความเอื้อเฟื้อเผื่อแผ่,บทสรุป
ความกระหายน้ำ,ความหิวความกระหายน้ำ,ส่วนตัวความกระหายน้ำ,ความหิว,ส่วนตัว
ความกลมกลืน,ความสมดุลความกลมกลืน,สถานทูตความกลมกลืน,ความสมดุล,สถานทูต
