target_word_unique,word_combo_related,word_combo_unrelated,cue_word_related,cue_word_unrelated
ผู้โจมตี,เหยื่อผู้โจมตี,การสัมมนาผู้โจมตี,เหยื่อ,การสัมมนา
ผู้ให้ข้อมูล,แหล่งที่มาผู้ให้ข้อมูล,เป็นที่นิยมผู้ให้ข้อมูล,แหล่งที่มา,เป็นที่นิยม
ผ้าขนหนู,ผ้าห่มผ้าขนหนู,ทหารเรือผ้าขนหนู,ผ้าห่ม,ทหารเรือ
ผ้าฝ้าย,ผ้าไหมผ้าฝ้าย,การแก้แค้นผ้าฝ้าย,ผ้าไหม,การแก้แค้น
ผ้าเช็ดหน้า,ผ้าผ้าเช็ดหน้า,นินจาผ้าเช็ดหน้า,ผ้า,นินจา
ฝัง,ขุดฝัง,โปรตีนฝัง,ขุด,โปรตีน
ฝุ่น,ขี้เถ้าฝุ่น,แม่น้ำฝุ่น,ขี้เถ้า,แม่น้ำ
ฝุ่นจับ,เป็นสนิมฝุ่นจับ,ต่ำกว่าฝุ่นจับ,เป็นสนิม,ต่ำกว่า
ฝ่ายตรงข้าม,ศัตรูฝ่ายตรงข้าม,เกาฝ่ายตรงข้าม,ศัตรู,เกา
พนักงานอัยการ,ทนายความพนักงานอัยการ,ควบคุมพนักงานอัยการ,ทนายความ,ควบคุม
พบปะ,พบพบปะ,ตระบองพบปะ,พบ,ตระบอง
พยายาม,ลองพยายาม,รถพ่วงพยายาม,ลอง,รถพ่วง
พรม,พื้นพรม,การไต่สวนพรม,พื้น,การไต่สวน
พระคาร์ดินัล,บิชอปพระคาร์ดินัล,กล่องพระคาร์ดินัล,บิชอป,กล่อง
พระราชา,พระราชินีพระราชา,ยาสูบพระราชา,พระราชินี,ยาสูบ
พละกำลัง,ความแข็งแกร่งพละกำลัง,สุขภาพพละกำลัง,ความแข็งแกร่ง,สุขภาพ
พลังงาน,พลังพลังงาน,ทำอาหารพลังงาน,พลัง,ทำอาหาร
พลาสติก,ปูนซีเมนต์พลาสติก,ผิดพลาสติก,ปูนซีเมนต์,ผิด
พังทลาย,ร่วงหล่นพังทลาย,การล่าสัตว์พังทลาย,ร่วงหล่น,การล่าสัตว์
พันล้าน,ล้านพันล้าน,อย่างเป็นธรรมชาติพันล้าน,ล้าน,อย่างเป็นธรรมชาติ
พันเอก,นายพลพันเอก,ความขัดแย้งพันเอก,นายพล,ความขัดแย้ง
พายุ,ลมพายุ,สิทธิพิเศษพายุ,ลม,สิทธิพิเศษ
พายุทอร์นาโด,พายุเฮอริเคนพายุทอร์นาโด,ทาสพายุทอร์นาโด,พายุเฮอริเคน,ทาส
พิธีการ,พิธีกรรมพิธีการ,บาสเกตบอลพิธีการ,พิธีกรรม,บาสเกตบอล
พิพิธภัณฑ์,ห้องสมุดพิพิธภัณฑ์,แก้ไขพิพิธภัณฑ์,ห้องสมุด,แก้ไข
พี่ชายน้องชาย,พี่สาวน้องสาวพี่ชายน้องชาย,ความคิดเห็นพี่ชายน้องชาย,พี่สาวน้องสาว,ความคิดเห็น
พื้นผิว,ชั้นพื้นผิว,แข็งแกร่งพื้นผิว,ชั้น,แข็งแกร่ง
พูด,พูดคุยพูด,ดาวเคราะห์พูด,พูดคุย,ดาวเคราะห์
พ่อ,ลุงพ่อ,ปรากฎขึ้นพ่อ,ลุง,ปรากฎขึ้น
พ่อครัว,ทำอาหารพ่อครัว,เสียงรบกวนพ่อครัว,ทำอาหาร,เสียงรบกวน
พ่อค้า,ทางการค้าพ่อค้า,ความสมดุลพ่อค้า,ทางการค้า,ความสมดุล
พ่อมด,เวทมนตร์พ่อมด,จมน้ำพ่อมด,เวทมนตร์,จมน้ำ
ฟัน,เล็บฟัน,มูลค่าฟัน,เล็บ,มูลค่า
ฟุตบอล,บาสเกตบอลฟุตบอล,ขุดฟุตบอล,บาสเกตบอล,ขุด
ฟ้าร้อง,ฟ้าแลบฟ้าร้อง,น่าสะอิดสะเอียนฟ้าร้อง,ฟ้าแลบ,น่าสะอิดสะเอียน
ภรรยา,สามีภรรยา,จรวดภรรยา,สามี,จรวด
ภรรยาของขุนนาง,บารอนภรรยาของขุนนาง,กฎภรรยาของขุนนาง,บารอน,กฎ
ภาพยนตร์,หนังโป๊ภาพยนตร์,ความซื่อสัตย์ภาพยนตร์,หนังโป๊,ความซื่อสัตย์
ภาพหลอน,ภาพลวงตาภาพหลอน,กระแสไฟฟ้าภาพหลอน,ภาพลวงตา,กระแสไฟฟ้า
ภายนอก,ภายในภายนอก,โทรภายนอก,ภายใน,โทร
ภารกิจ,งานภารกิจ,ยอมรับภารกิจ,งาน,ยอมรับ
ภาวะฉุกเฉิน,เร่งด่วนภาวะฉุกเฉิน,แบบอย่างภาวะฉุกเฉิน,เร่งด่วน,แบบอย่าง
ภาวะซึมเศร้า,ความเครียดภาวะซึมเศร้า,หมีภาวะซึมเศร้า,ความเครียด,หมี
ภูเขา,เนินเขาภูเขา,ฟังภูเขา,เนินเขา,ฟัง
มด,ผึ้งมด,หน้าต่างมด,ผึ้ง,หน้าต่าง
มนุษย์,คนมนุษย์,โลงศพมนุษย์,คน,โลงศพ
มนุษย์ต่างดาว,ยูเอฟโอมนุษย์ต่างดาว,กระเป๋าเสื้อหรือกางเกงมนุษย์ต่างดาว,ยูเอฟโอ,กระเป๋าเสื้อหรือกางเกง
มลรัฐ,สหพันธรัฐมลรัฐ,อย่างเชื่องช้ามลรัฐ,สหพันธรัฐ,อย่างเชื่องช้า
มหัศจรรย์,ยอดเยี่ยมมหัศจรรย์,การหมั้นหมายมหัศจรรย์,ยอดเยี่ยม,การหมั้นหมาย
มหาวิทยาลัย,วิทยาลัยมหาวิทยาลัย,เป็นไปไม่ได้มหาวิทยาลัย,วิทยาลัย,เป็นไปไม่ได้
มหาสมุทร,ทะเลมหาสมุทร,ประวัติโดยย่อมหาสมุทร,ทะเล,ประวัติโดยย่อ
มหึมา,ใหญ่มหึมา,ลูกสาวมหึมา,ใหญ่,ลูกสาว
มอร์ฟีน,แอสไพรินมอร์ฟีน,สถานที่มอร์ฟีน,แอสไพริน,สถานที่
มะเขือเทศ,มันฝรั่งมะเขือเทศ,เรียบร้อยแล้วมะเขือเทศ,มันฝรั่ง,เรียบร้อยแล้ว
มะเร็ง,เนื้องอกมะเร็ง,ไม่เป็นที่เปิดเผยมะเร็ง,เนื้องอก,ไม่เป็นที่เปิดเผย
มั่นคง,ปลอดภัยมั่นคง,จริงๆแล้วมั่นคง,ปลอดภัย,จริงๆแล้ว
มา,มาถึงมา,นักบินอวกาศมา,มาถึง,นักบินอวกาศ
มาก่อน,สายมาก่อน,จอภาพมาก่อน,สาย,จอภาพ
มาตรการ,กฎมาตรการ,โจรสลัดมาตรการ,กฎ,โจรสลัด
มายองเนส,ซอสมะเขือเทศมายองเนส,ดำเนินการต่อมายองเนส,ซอสมะเขือเทศ,ดำเนินการต่อ
มิตรภาพ,ความสัมพันธ์มิตรภาพ,ห้องมิตรภาพ,ความสัมพันธ์,ห้อง
มีความผิด,บริสุทธิ์ใจมีความผิด,มันฝรั่งมีความผิด,บริสุทธิ์ใจ,มันฝรั่ง
มีความสุข,พอใจมีความสุข,แอลกอฮอล์มีความสุข,พอใจ,แอลกอฮอล์
มีชื่อเสียง,เป็นที่นิยมมีชื่อเสียง,ระเบิดมีชื่อเสียง,เป็นที่นิยม,ระเบิด
มีด,ดาบมีด,ชัยชนะมีด,ดาบ,ชัยชนะ
มีประสิทธิภาพ,มีประโยชน์มีประสิทธิภาพ,เหนื่อยมีประสิทธิภาพ,มีประโยชน์,เหนื่อย
มีเสน่ห์,น่าดึงดูดใจมีเสน่ห์,ทุกข์ทรมานมีเสน่ห์,น่าดึงดูดใจ,ทุกข์ทรมาน
มีเหตุผล,คำอธิบายมีเหตุผล,เพื่อนร่วมงานมีเหตุผล,คำอธิบาย,เพื่อนร่วมงาน
มีเหตุผล.1,ยุติธรรมมีเหตุผล,โรมันมีเหตุผล,ยุติธรรม,โรมัน
มีเอกลักษณ์,พิเศษมีเอกลักษณ์,สองเท่ามีเอกลักษณ์,พิเศษ,สองเท่า
มือปืนลอบยิง,มือปืนมือปืนลอบยิง,กู้ภัยมือปืนลอบยิง,มือปืน,กู้ภัย
มืออาชีพ,มือสมัครเล่นมืออาชีพ,การยืนยันมืออาชีพ,มือสมัครเล่น,การยืนยัน
มื้ออาหาร,อาหารมื้ออาหาร,ทิศตะวันตกมื้ออาหาร,อาหาร,ทิศตะวันตก
ม้า,ลาม้า,สะดวกสบายม้า,ลา,สะดวกสบาย
ยกย่อง,ชื่นชมยกย่อง,คลับยกย่อง,ชื่นชม,คลับ
ยอดเยี่ยม,ดีเลิศยอดเยี่ยม,ดาวอังคารยอดเยี่ยม,ดีเลิศ,ดาวอังคาร
ยอมรับ,ปฏิเสธยอมรับ,หอคอยยอมรับ,ปฏิเสธ,หอคอย
ยังคง,เรียบร้อยแล้วยังคง,การเกิดยังคง,เรียบร้อยแล้ว,การเกิด
ยา,ยาเม็ดยา,การให้อภัยยา,ยาเม็ด,การให้อภัย
ยา.1,แอลกอฮอล์ยา,แกลเลอรี่ยา,แอลกอฮอล์,แกลเลอรี่
ยาว,สั้นยาว,หนียาว,สั้น,หนี
ยิง,ลูกกระสุนปืนยิง,รหัสยิง,ลูกกระสุนปืน,รหัส
ยืนยัน,การยืนยันยืนยัน,การบริการยืนยัน,การยืนยัน,การบริการ
ยืนยัน.1,ตรวจสอบยืนยัน,เงินบำนาญยืนยัน,ตรวจสอบ,เงินบำนาญ
ย่อหน้า,มาตราย่อหน้า,ปลื้มปีติย่อหน้า,มาตรา,ปลื้มปีติ
ย้อนกลับ,ถอยหลังย้อนกลับ,โดยบังเอิญย้อนกลับ,ถอยหลัง,โดยบังเอิญ
รถตู้,รถพ่วงรถตู้,ม่ายรถตู้,รถพ่วง,ม่าย
รถบรรทุก,รถจี๊ปรถบรรทุก,ฉีกรถบรรทุก,รถจี๊ป,ฉีก
รถยนต์,ยานพาหนะรถยนต์,สวัสดีรถยนต์,ยานพาหนะ,สวัสดี
รถลีมูซีน,รถแท็กซี่รถลีมูซีน,ไม่มีอะไรรถลีมูซีน,รถแท็กซี่,ไม่มีอะไร
รบกวน,ขัดจังหวะรบกวน,พายุเฮอริเคนรบกวน,ขัดจังหวะ,พายุเฮอริเคน
รวมตัว,เก็บรวบรวมรวมตัว,เจ้าหญิงรวมตัว,เก็บรวบรวม,เจ้าหญิง
รวย,ยากจนรวย,ศัลยแพทย์รวย,ยากจน,ศัลยแพทย์
รสบัส,รถไฟรสบัส,หลานปู่รสบัส,รถไฟ,หลานปู่
รหัสผ่าน,รหัสรหัสผ่าน,ปลาฉลามรหัสผ่าน,รหัส,ปลาฉลาม
รองเท้า,รองเท้าบูตรองเท้า,ขับรองเท้า,รองเท้าบูต,ขับ
รอดชีวิต,ดำเนินชีวิตรอดชีวิต,การประท้วงรอดชีวิต,ดำเนินชีวิต,การประท้วง
รอบ,ข้างนอกรอบ,กระดูกรอบ,ข้างนอก,กระดูก
รอบๆ,กลมรอบๆ,เลือดรอบๆ,กลม,เลือด
รอยช้ำ,เการอยช้ำ,ขัดจังหวะรอยช้ำ,เกา,ขัดจังหวะ
ระบบ,เครือข่ายระบบ,ดวงจันทร์ระบบ,เครือข่าย,ดวงจันทร์
ระบุ,ชี้ระบุ,กลอุบายระบุ,ชี้,กลอุบาย
ระยะเวลา,ระยะระยะเวลา,ลิงระยะเวลา,ระยะ,ลิง
ระเบิด,ดินปืนระเบิด,โอกาสระเบิด,ดินปืน,โอกาส
ระแวง,สงสัยระแวง,การเงินระแวง,สงสัย,การเงิน
รัก,เกลียดรัก,สิ่งแวดล้อมรัก,เกลียด,สิ่งแวดล้อม
รักษา,ฟื้นตัวรักษา,การผสมผสานรักษา,ฟื้นตัว,การผสมผสาน
รังสี,การปนเปื้อนรังสี,ชั้นเรียนรังสี,การปนเปื้อน,ชั้นเรียน
รัฐธรรมนูญ,กฏหมายรัฐธรรมนูญ,แปซิฟิกรัฐธรรมนูญ,กฏหมาย,แปซิฟิก
รัฐบาล,การบริหารรัฐกิจรัฐบาล,ช้ารัฐบาล,การบริหารรัฐกิจ,ช้า
รัฐมนตรี,เอกอัครราชทูตรัฐมนตรี,ถอยหลังรัฐมนตรี,เอกอัครราชทูต,ถอยหลัง
รั้ว,กำแพงรั้ว,ละลายรั้ว,กำแพง,ละลาย
ราคา,มูลค่าราคา,ราชวงศ์ราคา,มูลค่า,ราชวงศ์
ราคาถูก,ราคาเเพงราคาถูก,ห้องสมุดราคาถูก,ราคาเเพง,ห้องสมุด
รางวัล,เงินโบนัสรางวัล,โบสถ์รางวัล,เงินโบนัส,โบสถ์
รางวัล.1,โนเบลรางวัล,พระรางวัล,โนเบล,พระ
ราชนาวี,นาวิกโยธินราชนาวี,สมบัติราชนาวี,นาวิกโยธิน,สมบัติ
ราชอาณาจักร,ราชวงศ์ราชอาณาจักร,การนำทางราชอาณาจักร,ราชวงศ์,การนำทาง
รายสัปดาห์,รายวันรายสัปดาห์,มงกุฎรายสัปดาห์,รายวัน,มงกุฎ
รายได้,กำไรรายได้,อ่อนหวานรายได้,กำไร,อ่อนหวาน
รุ่งอรุณ,พระอาทิตย์ตกดินรุ่งอรุณ,ชายรุ่งอรุณ,พระอาทิตย์ตกดิน,ชาย
รุ่นน้อง,อาวุโสรุ่นน้อง,ปัจจัยรุ่นน้อง,อาวุโส,ปัจจัย
รู,รอยแตกรู,กวีรู,รอยแตก,กวี
รูปถ่าย,รูปภาพรูปถ่าย,อยู่รูปถ่าย,รูปภาพ,อยู่
รูปปั้น,อนุสาวรีย์รูปปั้น,การเปิดรูปปั้น,อนุสาวรีย์,การเปิด
รู้,จำได้รู้,ตราสัญลักษณ์รู้,จำได้,ตราสัญลักษณ์
รู้.1,ตอนนี้รู้,สมาชิกรู้,ตอนนี้,สมาชิก
ร่วมทาง,คุ้มกันร่วมทาง,หลุมฝังศพร่วมทาง,คุ้มกัน,หลุมฝังศพ
ร้องขอ,เรียกร้องร้องขอ,เคมีร้องขอ,เรียกร้อง,เคมี
ร้อย,พันร้อย,ขโมยร้อย,พัน,ขโมย
ร้านอาหาร,ผับร้านอาหาร,เอดส์ร้านอาหาร,ผับ,เอดส์
ร้ายแรง,ปางตายร้ายแรง,ตอนนี้ร้ายแรง,ปางตาย,ตอนนี้
ฤดูหนาว,ฤดูร้อนฤดูหนาว,วัตถุประสงค์ฤดูหนาว,ฤดูร้อน,วัตถุประสงค์
ฤดูใบไม้ร่วง,ฤดูใบไม้ผลิฤดูใบไม้ร่วง,ความสนใจฤดูใบไม้ร่วง,ฤดูใบไม้ผลิ,ความสนใจ
ลงทุน,การเงินลงทุน,ยืนลงทุน,การเงิน,ยืน
ลงนาม,แบบฟอร์มลงนาม,สมองลงนาม,แบบฟอร์ม,สมอง
ลด,เพิ่มลด,เกี่ยวกับอังกฤษลด,เพิ่ม,เกี่ยวกับอังกฤษ
ลบ,กำจัดลบ,ผึ้งลบ,กำจัด,ผึ้ง
ลบ.1,บวกลบ,รอยสักลบ,บวก,รอยสัก
ละครตลก,บทละครละครตลก,กรรมละครตลก,บทละคร,กรรม
ละครสัตว์,สวนสัตว์ละครสัตว์,คว้าละครสัตว์,สวนสัตว์,คว้า
ลาก่อน,สวัสดีลาก่อน,ไตลาก่อน,สวัสดี,ไต
ลาดตระเวน,อารักขาลาดตระเวน,เปลี่ยนลาดตระเวน,อารักขา,เปลี่ยน
ลายนิ้วมือ,ดีเอ็นเอลายนิ้วมือ,โอชาลายนิ้วมือ,ดีเอ็นเอ,โอชา
ลำดับที่สี่,ลำดับที่สามลำดับที่สี่,ความเปลี่ยนแปลงลำดับที่สี่,ลำดับที่สาม,ความเปลี่ยนแปลง
ลูกค้า,คนไข้ลูกค้า,ไวรัสลูกค้า,คนไข้,ไวรัส
ลูกชาย,ลูกสาวลูกชาย,คล้ายกันลูกชาย,ลูกสาว,คล้ายกัน
ลูกพี่ลูกน้อง,ญาติลูกพี่ลูกน้อง,วิวัฒนาการลูกพี่ลูกน้อง,ญาติ,วิวัฒนาการ
ล็อก,กุญแจล็อก,อาชีพล็อก,กุญแจ,อาชีพ
ล็อบสเตอร์,ทูน่าล็อบสเตอร์,คัมภีร์ไบเบิลล็อบสเตอร์,ทูน่า,คัมภีร์ไบเบิล
ล่างสุด,สูงสุดล่างสุด,ตรวจสอบล่างสุด,สูงสุด,ตรวจสอบ
ล้าง,ทำความสะอาดล้าง,การแจ้งเตือนล้าง,ทำความสะอาด,การแจ้งเตือน
วงดนตรี,วงออเคสตราวงดนตรี,ดีเลิศวงดนตรี,วงออเคสตรา,ดีเลิศ
วงโคจร,ดาวเคราะห์วงโคจร,แอสไพรินวงโคจร,ดาวเคราะห์,แอสไพริน
วนิลา,อบเชยวนิลา,คุณปู่คุณตาวนิลา,อบเชย,คุณปู่คุณตา
วรรณกรรม,ศิลปะวรรณกรรม,วัววรรณกรรม,ศิลปะ,วัว
วลี,พจนานุกรมวลี,ปริมาณวลี,พจนานุกรม,ปริมาณ
วอดก้า,วิสกี้วอดก้า,ผู้เชี่ยวชาญวอดก้า,วิสกี้,ผู้เชี่ยวชาญ
วัคซีน,ยาแก้พิษวัคซีน,หนักวัคซีน,ยาแก้พิษ,หนัก
วัตถุระเบิด,ระเบิดวัตถุระเบิด,วันครบรอบวัตถุระเบิด,ระเบิด,วันครบรอบ
วัตสัน,เชอร์ล็อกวัตสัน,ผมวัตสัน,เชอร์ล็อก,ผม
วันหยุด,คริสต์มาสวันหยุด,ความต้องการวันหยุด,คริสต์มาส,ความต้องการ
วันอังคาร,วันจันทร์วันอังคาร,ผ้าวันอังคาร,วันจันทร์,ผ้า
วันอาทิตย์,วันเสาร์วันอาทิตย์,เงินโบนัสวันอาทิตย์,วันเสาร์,เงินโบนัส
วันเกิด,วันครบรอบวันเกิด,บาปวันเกิด,วันครบรอบ,บาป
วัยรุ่น,เกี่ยวกับวัยรุ่นวัยรุ่น,ลูกเรือวัยรุ่น,เกี่ยวกับวัยรุ่น,ลูกเรือ
วัยเด็ก,วัยหนุ่มสาววัยเด็ก,กฏหมายวัยเด็ก,วัยหนุ่มสาว,กฏหมาย
วาด,ระบายสีวาด,มีความเห็นอกเห็นใจวาด,ระบายสี,มีความเห็นอกเห็นใจ
วิกฤติ,สถานการณ์วิกฤติ,เซ็นเซอร์วิกฤติ,สถานการณ์,เซ็นเซอร์
